{
  "case_id": "FIRE-D4-SECTION13-CONTROL-001",
  "standard": "SP554_2026",
  "action": "sp554_fire_result_assessment",
  "thermal_route": "UNPROTECTED_STEP_12_2",
  "critical_temperature_c": 525.0192844353662,
  "reduced_thickness_mm": 10.0,
  "initial_temperature_c": 20.0,
  "time_step_min": 0.1,
  "max_time_min": 60.0,
  "steel_properties_source": "sp554_12_2_defaults",
  "required_fire_resistance_min": 15.0,
  "fire_regime": "standard",
  "requirement_provenance": {
    "source_kind": "external_normative_requirement",
    "source_document": "Explicit project fire-safety requirement (control case)",
    "source_reference": "Required load-bearing fire resistance R 15",
    "value_min": 15.0,
    "note": "Control input only; FIRE-D4 does not derive this value from building classification."
  }
}
